Statement,Rating,Category
"You're not willing to listen, and need to do it my way - I know what's best for you.",0,Emotional Cooperation
"I'm here to support you, and help you manage your anxiety - we can get through this together.",1,Anxiety Support
"You need to calm down, and stop worrying so much - it's not good for your health.",0,Anxiety Support
"You're stressing too much, and need to relax - take a deep breath and let's find a solution.",0,Stress Dismissal
"I understand that you're feeling overwhelmed, and I'm here to help - let's find a way to make it more manageable.",1,Stress Dismissal
"I'm here to listen, and offer support - you're not alone in this.",1,Supportiveness
"I can imagine how difficult this must be for you, and I'm here to help.",1,Emotional Awareness
"I understand that you're feeling scared, and uncertain about the future - I'm here to support you.",1,Emotional Awareness
"I'm here to support you, and help you find a solution - we can get through this together.",1,Emotional Support
"Everything will be okay, don't worry - I'm here to support you.",1,Calmness and Reassurance
"Let's take a deep breath, and find a way to make this work - I'm here to help.",1,Calmness and Reassurance
"I'm here to help you find a solution, and support you through this difficult time.",1,Emotional Understanding
"Let's work together to find a solution, and support each other through this.",1,Emotional Cooperation
"That sounds really tough, and I'm here to support you through it.",1,Empathy
"You're feeling anxious, and that's okay - it's a normal feeling in situations like this.",1,Anxiety Support
"I can see why you'd feel that way, and I'm here to listen and offer support - sometimes it helps to talk through your feelings and get things off your chest.",1,Understanding and Validation
"You're feeling overwhelmed, and that's okay - it's a normal feeling in situations like this, and I'm here to help you find a way to manage it.",1,Understanding and Validation
"I'm here to support you, and help you manage your stress and anxiety - let's find ways to make it more manageable, and work together to find a solution.",1,Supportiveness
"I'm here to listen, and offer support - you're not alone in this, and I care about how you're feeling.",1,Supportiveness
"I can imagine how difficult this must be for you, and I'm here to help - let's work together to find a way to make this situation more bearable.",1,Emotional Awareness
"I understand that you're feeling scared, and uncertain about the future - I'm here to support you, and help you find a way to feel more secure.",1,Emotional Awareness
"You're doing the best you can, and that's something to be proud of - don't be too hard on yourself, and remember that it's okay to ask for help when you need it.",1,Emotional Support
"I'm here to support you, and help you find a solution - we can get through this together, and I'll be here every step of the way.",1,Emotional Support
"Everything will be okay, don't worry - I'm here to support you, and we'll get through this together, one step at a time.",1,Calmness and Reassurance
"Let's take a deep breath, and find a way to make this work - I'm here to help, and we can do this together.",1,Calmness and Reassurance
"I'm here to help you find a solution, and support you through this difficult time - let's work together to find a way to make this situation more manageable.",1,Emotional Understanding
"Let's work together to find a solution, and support each other through this - we can do this, and I'm here to help.",1,Emotional Cooperation
"That sounds really tough, and I'm here to support you through it - let's find a way to make this situation more bearable, and work together to find a solution.",1,Empathy
"I appreciate your strength, and resilience - you're doing a great job, and I'm here to support you.",1,Resilience Recognition
"You're feeling anxious, and that's okay - it's a normal feeling in situations like this, and I'm here to help you find a way to manage it.",1,Anxiety Support
"I can see why you'd feel that way, and I'm here to listen and offer support - sometimes it helps to talk through your feelings and get things off your chest, and I'm here to listen without judgment.",1,Understanding and Validation
"You're feeling overwhelmed, and that's okay - it's a normal feeling in situations like this, and I'm here to help you find a way to manage it, and break it down into smaller, more manageable tasks.",1,Understanding and Validation
"I'm here to support you, and help you manage your stress and anxiety - let's find ways to make it more manageable, and work together to find a solution that works for you.",1,Supportiveness
"I'm here to listen, and offer support - you're not alone in this, and I care about how you're feeling, and want to help you find a way to feel better.",1,Supportiveness
"I can imagine how difficult this must be for you, and I'm here to help - let's work together to find a way to make this situation more bearable, and find a solution that works for you.",1,Emotional Awareness
"I understand that you're feeling scared, and uncertain about the future - I'm here to support you, and help you find a way to feel more secure, and in control of your situation.",1,Emotional Awareness
"You're doing the best you can, and that's something to be proud of - don't be too hard on yourself, and remember that it's okay to ask for help when you need it, and that I'm here to support you.",1,Emotional Support
"I'm here to support you, and help you find a solution - we can get through this together, and I'll be here every step of the way, offering guidance and support.",1,Emotional Support
"Everything will be okay, don't worry - I'm here to support you, and we'll get through this together, one step at a time, and I'll help you find a way to make this situation more manageable.",1,Calmness and Reassurance
"Let's take a deep breath, and find a way to make this work - I'm here to help, and we can do this together, and find a solution that works for you.",1,Calmness and Reassurance
"I'm here to help you find a solution, and support you through this difficult time - let's work together to find a way to make this situation more manageable, and find a way to move forward.",1,Emotional Understanding
"Let's work together to find a solution, and support each other through this - we can do this, and I'm here to help, and offer guidance and support every step of the way.",1,Emotional Cooperation
"That sounds really tough, and I'm here to support you through it - let's find a way to make this situation more bearable, and work together to find a solution that works for you.",1,Empathy
"I appreciate your strength, and resilience - you're doing a great job, and I'm here to support you, and help you find a way to keep moving forward.",1,Resilience Recognition
"You're feeling anxious, and that's okay - it's a normal feeling in situations like this, and I'm here to help you find a way to manage it, and feel more calm and centered.",1,Anxiety Support
"You're just being too sensitive, and need to toughen up - it's not that big of a deal, and you're overreacting.",0,Understanding and Validation
"You're on your own with this one, and need to figure it out yourself - I'm not here to hold your hand through every difficult situation.",0,Supportiveness
"You're being too emotional, and need to calm down - it's not that serious, and you're overreacting.",0,Emotional Awareness
"You're not trying hard enough, and need to step it up - you're capable of more, and I expect to see better results.",0,Emotional Support
"You're worrying too much, and need to relax - it's not that big of a deal, and you're overreacting.",0,Calmness and Reassurance
"You're not good enough, and need to try harder - you're not meeting expectations, and need to do better.",0,Encouragement Minimization
"You're not willing to listen, and need to do it my way - I know what's best for you, and you need to trust me.",0,Emotional Cooperation
"You're being too sensitive, and need to toughen up - it's not that serious, and you're overreacting.",0,Empathy
"You're not strong enough, and need to toughen up - you're not capable of handling this, and need help.",0,Resilience Recognition
"I'm here to support you, and help you manage your anxiety - let's find ways to make it more manageable, and work together to find a solution that works for you.",1,Anxiety Support
"Considering the complexity of this issue, it might be beneficial for us to draw up a detailed plan that outlines each step we should take. This way, we can tackle the problem methodically and ensure we don't overlook any important details.",1,Problem Solving
I don't understand why you always need so much help. This problem isn't that complex; just use some common sense and solve it without dragging others into it.,0,Problem Solving
"If we approach this issue from multiple angles and incorporate feedback from different team members, we can gain a more comprehensive understanding of the situation and devise a more effective solution. Let’s schedule some brainstorming sessions and get everyone involved.",1,Problem Solving
"You keep bringing up this issue as if it's unsolvable. It's actually quite simple, and honestly, you should have resolved it by now without needing to constantly seek assistance.",0,Problem Solving
"Let's consider using some specialized software or tools that could help us analyze the data more efficiently. By leveraging technology, we can perhaps see patterns or solutions that weren't apparent before. What do you think about this approach?",1,Problem Solving
"Why do you make everything so complicated? Look, just do the easiest thing that comes to mind and move on. We don’t have all day to ponder every possible option.",0,Problem Solving
This is a unique challenge that might require us to think outside the box. Let’s put our heads together and think creatively. Maybe there’s an innovative approach we haven’t considered yet that could be just what we need to solve this.,1,Problem Solving
"Every time there's a problem, you act as if the sky is falling. Just handle it the way you've seen it done before and stop making such a big fuss.",0,Problem Solving
"To ensure we address this thoroughly, let's map out all the stakeholders' needs and expectations first. Understanding these will guide our decision-making process and help us come up with a solution that satisfies all parties involved.",1,Problem Solving
It's not rocket science. Just pick the obvious solution and implement it. There’s no need to waste time exploring every conceivable option.,0,Problem Solving
"Given the intricacies of this problem, it might be wise for us to consult with some external experts who can offer fresh perspectives and insights. This could enlighten our understanding and open up new pathways for resolution.",1,Problem Solving
Can you just deal with it already? We've been over this before and it's not that difficult. Just follow the steps from last time and it should work out.,0,Problem Solving
"I'm here to assist you, and help you navigate your stress and anxiety - let's explore ways to make it more manageable, and collaborate to find a solution that suits you.",1,Supportiveness
"You're on your own with this one, and need to figure it out yourself - I'm not here to hold your hand through every challenging situation.",0,Supportiveness
"I can envision how difficult this must be for you, and I'm here to aid you - let's work together to find a way to make this situation more tolerable, and discover a solution that suits you.",1,Emotional Awareness
"You're being too sensitive, and need to calm down - it's not that severe, and you're overreacting.",0,Emotional Awareness
"You're doing your best, and that's something to be proud of - don't be too hard on yourself, and remember that it's okay to ask for help when you need it, and that I'm here to assist you.",1,Emotional Support
"You're not trying hard enough, and need to step up your game - you're capable of more, and I expect to see better results.",0,Emotional Support
"Everything will be alright, don't worry - I'm here to support you, and we'll get through this together, one step at a time, and I'll help you find a way to make this situation more manageable.",1,Calmness and Reassurance
"Let's take a deep breath, and find a way to make this work - I'm here to help, and we can do this together, and discover a solution that suits you.",1,Calmness and Reassurance
"I'm here to help you find a solution, and support you through this difficult time - let's work together to find a way to make this situation more manageable, and discover a way to move forward.",1,Emotional Understanding
"That sounds really tough, and I'm here to support you through it - let's find a way to make this situation more bearable, and work together to discover a solution that suits you.",1,Empathy
"You're being too sensitive, and need to toughen up - it's not that severe, and you're overreacting.",0,Empathy
"I admire your strength, and resilience - you're doing a great job, and I'm here to support you, and help you find a way to keep moving forward.",1,Resilience Recognition
"I'm here to guide you, and help you cope with your stress and anxiety - let's explore ways to make it more manageable, and work together to find a solution that works for you.",1,Supportiveness
"You're on your own with this one, and need to figure it out yourself - I'm not here to babysit you through every difficult situation.",0,Supportiveness
"I can understand how challenging this must be for you, and I'm here to support you - let's collaborate to find a way to make this situation more tolerable, and discover a solution that suits you.",1,Emotional Awareness
"You're doing your best, and that's something to be proud of - don't be too hard on yourself, and remember that it's okay to ask for help when you need it, and that I'm here to support you.",1,Emotional Support
"I'm here to support you, and help you manage your stress - let's find ways to make it more manageable, and work together to discover a solution that suits you.",1,Stress Management
"I understand that you're feeling overwhelmed, and uncertain about the future - I'm here to support you, and help you find a way to feel more secure, and in control of your situation.",1,Emotional Awareness
I'm here to help.,1,Supportiveness
You're on your own.,0,Supportiveness
I understand.,1,Emotional Awareness
Calm down.,0,Emotional Awareness
You're doing great.,1,Emotional Support
Try harder.,0,Emotional Support
"Don't worry, I'm here.",1,Calmness and Reassurance
It's not that bad.,0,Calmness and Reassurance
Let's work together.,1,Calmness and Reassurance
You're not good enough.,0,Encouragement Minimization
Let's find a solution.,1,Emotional Understanding
Do it my way.,0,Emotional Cooperation
"That's tough, but I'm here.",1,Empathy
Toughen up.,0,Empathy
You're strong and capable.,1,Resilience Recognition
You need help.,0,Resilience Recognition
Let's manage your stress.,1,Stress Management
"Try harder, you can do it.",0,Stress Management
We can do this together.,1,Emotional Cooperation
"Trust me, I know what's best.",0,Emotional Cooperation
You're overreacting.,0,Emotional Awareness
I can see that this situation is really affecting you emotionally. It’s important that we acknowledge how you’re feeling as we discuss possible solutions. How can I best support you right now?,1,Emotional Awareness and Supportiveness
Just stop letting your emotions rule you. We need to focus on the facts and not get sidetracked by feelings.,0,Emotional Awareness and Supportiveness
"Your emotions are a key part of your experience, and understanding them can help us both move forward more effectively. Would you like to share more about what you’re feeling?",1,Emotional Awareness and Supportiveness
Emotions shouldn't interfere with decisions. Just set them aside and let's deal with the real issues at hand.,0,Emotional Awareness and Supportiveness
Recognizing that you’re feeling overwhelmed is the first step. Let's take a moment to calm down and approach this situation with a clear mind. What can I do to help alleviate your stress?,1,Emotional Awareness and Supportiveness
People get too caught up in their feelings. You need to learn to control them if you’re going to succeed here.,0,Emotional Awareness and Supportiveness
It sounds like this has been a difficult time for you. I'm here to listen and help you through this. What's the most challenging part for you right now?,1,Emotional Awareness and Supportiveness
Why are you always so emotional? We have work to do and can't be bogged down by every little feeling.,0,Emotional Awareness and Supportiveness
Feeling anxious about this is completely natural. Let’s discuss what’s making you anxious and see how we can reduce that anxiety together. Would that be okay?,1,Emotional Awareness and Supportiveness
It’s just stress. Everyone deals with it – no need to make a big deal about it.,0,Emotional Awareness and Supportiveness
I appreciate you expressing your concerns and feelings about this issue. Let's explore what's causing these emotions and find a way to address them constructively. Can we start by identifying what triggers these feelings?,1,Emotional Awareness and Supportiveness
You need to toughen up and stop being so sensitive. We can’t afford to waste time on this emotional stuff.,0,Emotional Awareness and Supportiveness
I've got your back.,1,Supportiveness
You're alone in this.,0,Supportiveness
I feel your pain.,1,Emotional Awareness
Get over it.,0,Emotional Awareness
You're doing okay.,1,Emotional Support
You're not trying hard enough.,0,Emotional Support
Everything will be alright.,1,Calmness and Reassurance
It's no big deal.,0,Calmness and Reassurance
Let's tackle this together.,1,Calmness and Reassurance
Do it my way or else.,0,Emotional Cooperation
"That's tough, but I'm here for you.",1,Empathy
You're being too sensitive.,0,Empathy
"You need help, you can't do it alone.",0,Resilience Recognition
Let's manage your stress together.,1,Stress Management
You need to try harder.,0,Stress Management
"We can do this together, as a team.",1,Emotional Cooperation
"Trust me, I know what's best for you.",0,Emotional Cooperation
"I'm here to support you, always.",1,Emotional Awareness
You're not willing to listen.,0,Emotional Cooperation
We're in this together.,1,Supportiveness
"You're on your own, good luck.",0,Supportiveness
"Get over it, it's not that bad.",0,Emotional Awareness
You're doing the best you can.,1,Emotional Support
"You need to try harder, you're not meeting expectations.",0,Emotional Support
"Everything will work out, don't worry.",1,Calmness and Reassurance
"It's not a big deal, relax.",0,Calmness and Reassurance
"You're not good enough, you need to improve.",0,Encouragement Minimization
Let's find a way to make this work.,1,Emotional Understanding
"Do it my way, it's the only way.",0,Emotional Cooperation
"That's tough, but I'm here to support you.",1,Empathy
"You're being too sensitive, toughen up.",0,Empathy
"You're strong and capable, you got this.",1,Resilience Recognition
"Let's manage your stress, it's affecting your health.",1,Stress Management
"You need to try harder, you're not trying your best.",0,Stress Management
"We can do this together, we're a team.",1,Emotional Cooperation
"Trust me, I know what's best for you, don't question it.",0,Emotional Cooperation
"You're overreacting, calm down and think clearly.",0,Emotional Awareness
"Let's work together to find a solution, we can do it.",1,Emotional Understanding
"You're not willing to listen, that's not going to work.",0,Emotional Cooperation
"We've got this, together.",1,Supportiveness
"You're alone, figure it out.",0,Supportiveness
"I feel your pain, literally.",1,Emotional Awareness
"Get over it, it's just a scratch.",0,Emotional Awareness
"You're doing great, keep it up!",1,Emotional Support
"You're not meeting expectations, try harder.",0,Emotional Support
"Everything will be okay, I promise.",1,Calmness and Reassurance
"It's no big deal, don't worry about it.",0,Calmness and Reassurance
"Let's work together, we can do it!",1,Calmness and Reassurance
"You're not good enough, you need to improve now.",0,Encouragement Minimization
"Let's find a solution, together.",1,Emotional Understanding
"Do it my way, or you'll fail.",0,Emotional Cooperation
"That's tough, but I'm here for you, always.",1,Empathy
"You're being too sensitive, toughen up already!",0,Empathy
"You're strong and capable, believe in yourself!",1,Resilience Recognition
"You need help, you can't do it alone, don't try.",0,Resilience Recognition
"Let's manage your stress, before it's too late.",1,Stress Management
"You need to try harder, you're not even trying!",0,Stress Management
"We can do this together, we're a team, remember?",1,Emotional Cooperation
"Trust me, I know what's best for you, don't question it again.",0,Emotional Cooperation
"I'm here to support you, no matter what, always.",1,Emotional Awareness
"You're overreacting, calm down and think clearly, please.",0,Emotional Awareness
"Let's work together to find a solution, we can do it, I know we can!",1,Emotional Understanding
"You're not willing to listen, that's not going to work, ever.",0,Emotional Cooperation
I hear you; that must be really tough.,1,Empathy
Just get over it; it's not that big of a deal.,0,Empathy
I'm here for you; tell me more about what you're going through.,1,Empathy
Why do you always make everything so dramatic?,0,Empathy
It sounds like you're really struggling. How can I help?,1,Empathy
Stop complaining and just deal with it.,0,Empathy
Thank you for sharing that with me. I'm here to support you.,1,Empathy
People have worse problems than you do.,0,Empathy
"Your feelings are valid, and I'm here to listen.",1,Empathy
Nobody else seems to have a problem with this.,0,Empathy
I understand why you feel that way. It makes a lot of sense.,1,Empathy
Just suck it up and move on.,0,Empathy
"We're a team, we can do this!",1,Supportiveness
"You're on your own, good luck with that.",0,Supportiveness
I understand you perfectly.,1,Emotional Awareness
"Get over it, it's not a big deal.",0,Emotional Awareness
"You're amazing, keep going!",1,Emotional Support
"You're not good enough, try harder.",0,Emotional Support
"Everything will be alright, trust me.",1,Calmness and Reassurance
"It's no big deal, don't stress about it.",0,Calmness and Reassurance
"Let's work together, we're stronger together.",1,Calmness and Reassurance
"Let's find a solution, we can do it!",1,Emotional Understanding
"Do it my way, or you'll regret it.",0,Emotional Cooperation
"You need help, you can't do it alone, don't even try.",0,Resilience Recognition
"We're in this together, always.",1,Supportiveness
"You're alone, figure it out yourself.",0,Supportiveness
"We've got this, together, always!",1,Supportiveness
"You're alone, good luck with that, you'll need it.",0,Supportiveness
"I understand you perfectly, without a doubt.",1,Emotional Awareness
"Get over it, it's not a big deal, move on.",0,Emotional Awareness
"You're amazing, keep going, you're doing great!",1,Emotional Support
"You're not good enough, try harder, you can do better.",0,Emotional Support
"Everything will be alright, trust me, I've got your back.",1,Calmness and Reassurance
"It's no big deal, don't stress about it, it's not worth it.",0,Calmness and Reassurance
"Let's work together, we're stronger together, always.",1,Calmness and Reassurance
"You're not good enough, you need to improve now, no excuses.",0,Encouragement Minimization
"Let's find a solution, we can do it, together, as a team!",1,Emotional Understanding
"Do it my way, or you'll regret it, don't say I didn't warn you.",0,Emotional Cooperation
"That's tough, but I'm here for you, always, no matter what.",1,Empathy
"You're being too sensitive, toughen up already, it's not that bad!",0,Empathy
"You're strong and capable, believe in yourself, you got this!",1,Resilience Recognition
"You need help, you can't do it alone, don't even try, you'll fail.",0,Resilience Recognition
"Let's manage your stress, before it's too late, let's do this!",1,Stress Management
"You need to try harder, you're not even trying, that's not good enough!",0,Stress Management
"We can do this together, we're a team, remember, we're in this together!",1,Emotional Cooperation
"Trust me, I know what's best for you, don't question it again, just listen.",0,Emotional Cooperation
"I'm here to support you, no matter what, always, without a doubt.",1,Emotional Awareness
"You're overreacting, calm down and think clearly, please, it's not that bad!",0,Emotional Awareness
"Let's work together to find a solution, we can do it, I know we can, let's do this!",1,Emotional Understanding
"You're not willing to listen, that's not going to work, ever, you need to listen.",0,Emotional Cooperation
"We're a team, we can do this, let's do it!",1,Supportiveness
"You're alone, good luck, you'll need it, bye.",0,Supportiveness
"I understand you, always, without a doubt.",1,Emotional Awareness
"Get over it, it's not a big deal, move on, already.",0,Emotional Awareness
"You're amazing, keep going, you're doing great, keep it up!",1,Emotional Support
"You're not good enough, try harder, you can do better, come on.",0,Emotional Support
"Everything will be alright, trust me, I've got your back, always.",1,Calmness and Reassurance
"It's no big deal, don't stress about it, it's not worth it, relax.",0,Calmness and Reassurance
"Let's work together, we're stronger together, always, united.",1,Calmness and Reassurance
"You're not good enough, you need to improve now, no excuses, period.",0,Encouragement Minimization
"Let's find a solution, we can do it, together, as a team, let's do this!",1,Emotional Understanding
"Do it my way, or you'll regret it, don't say I didn't warn you, listen.",0,Emotional Cooperation
