Statement,Rating,Category
"That's tough, but I'm here for you, always, no matter what, I care.",1,Empathy
"You're being too sensitive, toughen up already, it's not that bad, come on.",0,Empathy
"You're strong and capable, believe in yourself, you got this, go for it!",1,Resilience Recognition
"You need help, you can't do it alone, don't even try, you'll fail, trust me.",0,Resilience Recognition
"Let's manage your stress, before it's too late, let's do this, now!",1,Stress Management
"You need to try harder, you're not even trying, that's not good enough, come on.",0,Stress Management
"We can do this together, we're a team, remember, we're in this together, always.",1,Emotional Cooperation
"Trust me, I know what's best for you, don't question it again, just listen, please.",0,Emotional Cooperation
"I'm here to support you, no matter what, always, without a doubt, I care.",1,Emotional Awareness
"You're overreacting, calm down and think clearly, please, it's not that bad, relax.",0,Emotional Awareness
"Let's work together to find a solution, we can do it, I know we can, let's do this, now!",1,Emotional Understanding
"You're not willing to listen, that's not going to work, ever, you need to listen, come on.",0,Emotional Cooperation
"Believe in yourself, you got this!",1,Confidence Boost
Let's work together to achieve greatness!,1,Teamwork Encouragement
"You're alone in this, good luck.",0,Isolation Warning
"I understand your struggles, let's overcome them together.",1,Empathetic Support
"Get over it, it's just a minor setback.",0,Resilience Test
"Your strength inspires me, keep going!",1,Admiration Boost
"You're not strong enough, you need help.",0,Weakness Alert
"Let's celebrate your successes, you deserve it!",1,Celebratory Support
"Your determination is inspiring, keep pushing!",1,Motivational Support
"You're not cut out for this, give up.",0,Discouragement Warning
Let's work together to create something amazing!,1,Creative Collaboration
"You're on your own, figure it out.",0,Independence Test
"I believe in your potential, let's unlock it!",1,Potential Unleashing
"Your mistakes are holding you back, try harder.",0,Mistake Minimization
"Your passion is contagious, keep sharing it!",1,Passionate Support
"You're not good enough, you need to try harder.",0,Improvement Demand
"Let's celebrate your progress, no matter how small!",1,Progress Celebration
"You're overthinking it, just relax.",0,Calmness Advice
"Your resilience is admirable, keep pushing through!",1,Resilience Support
"Your creativity is a gift, share it with the world!",1,Creative Encouragement
"Your fears are holding you back, face them head-on.",0,Fear Confrontation
"Let's turn your dreams into reality, together!",1,Dream Achievement
"Your excuses are holding you back, take responsibility.",0,Accountability Encouragement
"Your kindness is contagious, keep spreading it!",1,Kindness Support
"Your self-doubt is normal, but don't let it define you.",0,Self-Doubt Awareness
"Your talents are unique, don't compare yourself to others.",1,Uniqueness Celebration
"Your procrastination is holding you back, take action now.",0,Procrastination Warning
"Your positivity is inspiring, keep shining!",1,Positivity Support
"Your mistakes are opportunities for growth, learn from them.",0,Mistake Learning
"Your authenticity is refreshing, don't change for anyone!",1,Authenticity Support
"Your comfort zone is holding you back, take the leap!",0,Comfort Zone Challenge
"Your empathy is a superpower, use it to uplift others!",1,Empathy Encouragement
"Your negative self-talk is toxic, replace it with positivity!",0,Negative Self-Talk Awareness
"Your creativity is a force to be reckoned with, keep innovating!",1,Creative Encouragement
"Your fear of failure is holding you back, take the risk!",0,Fear of Failure Awareness
"Your kindness is a beacon of hope, keep shining!",1,Kindness Support
"Your self-care is essential, prioritize it always!",0,Self-Care Reminder
"Your resilience is a strength, keep pushing through!",1,Resilience Support
"Your dreams are worth fighting for, don't give up!",0,Dream Encouragement
